<?xml version='1.0' encoding='UTF-8'?>

<!ELEMENT propertylist (category+)>

<!ELEMENT category (item+)>
<!ATTLIST category
    name CDATA #REQUIRED
  >

<!ELEMENT item EMPTY>
<!ATTLIST item
    label CDATA #IMPLIED
    name CDATA #REQUIRED
  >